asin,title,price,num_of_ratings,average_rating,main_image,all_images,product_description,about_product,product_information
B0BRKKVSD7,"IBELL 80cm (32 inches) Smart LED TV - HD Ready, Android 9.0, Smart Features, Crisp Display, Sleek Design (LES325SE, Black)","10,899",98,4.7,https://m.media-amazon.com/images/I/51mTQTu2bEL.jpg,"[""https://m.media-amazon.com/images/I/51mTQTu2bEL.jpg"", ""https://m.media-amazon.com/images/I/71whsjSE0gL._SL1500_.jpg"", ""https://m.media-amazon.com/images/I/61vo-1YST0L._SL1500_.jpg"", ""https://m.media-amazon.com/images/I/61md6-616gL._SL1500_.jpg"", ""https://m.media-amazon.com/images/I/712EThgRtYL._SL1500_.jpg"", ""https://m.media-amazon.com/images/I/519aZLzkVQL._SL1500_.jpg""]","Experience immersive entertainment with our 32-inch Smart TV, delivering stunning visuals and seamless connectivity in a sleek design. Featuring a vibrant LED display, this TV offers crisp, clear picture quality with vivid colors and sharp contrast. Whether you're watching movies, streaming your favorite shows, or gaming, every detail comes to life on the big screen. With built-in Wi-Fi connectivity, accessing your favorite content is easier than ever. Enjoy a wide range of streaming apps, including Netflix, Amazon Prime Video, and YouTube, right at your fingertips. Plus, with HDMI and USB ports, you can easily connect your devices to expand your entertainment options. The smart TV also comes equipped with advanced features like voice control, allowing you to search for content, control settings, and more, all with just your voice. Additionally, built-in speakers deliver immersive sound, enhancing your viewing experience. Sleek and stylish, our 32-inch Smart TV is the perfect addition to any room. Upgrade your home entertainment setup today and enjoy endless hours of entertainment at your fingertips.","['Resolution: HD Ready (1368 x 768 pixels) | Refresh Rate: 60Hz', '2 AV Input Slot | 1 AV Output Slot | Sound: 20 Watts Output | Digital Sound', 'Display: 80 cm Wide Display | Higher Contrast And Wider Color Range |', 'Connectivity: 1 HDMI Ports to connect set top box, Blu Ray players, gaming console | 2 USB Ports to connect hard drives and other USB devices | 1 VGA Slot to connect your', 'OS: Android Operting System With Inbuilt WiFi System And Rj45 Internet System', 'Picture Qulaity: LED Back Light Technology', 'Body: Ultra Slim Body And Narrow Frame Design', 'Energy Saver: Upto 40% Energy Saving And Eco-Friendly', '3 Year Warranty On Registration (Registration should be done within 30 days from the date of purchase).']","{""Brand"": ""IBELL"", ""Manufacturer"": ""iBELL"", ""Model"": ""IBLLES325SE"", ""Model Name"": ""IBLLES325SE"", ""Model Year"": ""2024"", ""Product Dimensions"": ""5 x 73.5 x 48 cm; 6.96 kg"", ""Item model number"": ""IBLLES325SE"", ""Memory Storage Capacity"": ""8 GB"", ""Ram Memory Installed Size"": ""512 MB"", ""Operating System"": ""Android"", ""Hardware Interface"": ""VGA, USB, HDMI"", ""Tuner Technology"": ""ATSC"", ""Resolution"": ""1366\u00d7768 Pixels"", ""Special Features"": ""Flat"", ""Mounting Hardware"": ""TV unit, warranty card, stand, Wall mount, Remote"", ""Number of items"": ""1"", ""Display Technology"": ""LED"", ""Standing screen display size"": ""32 Inches"", ""Display Type"": ""LED"", ""Viewing Angle"": ""178 Degrees"", ""Image Aspect Ratio"": ""16:9"", ""Screen Resolution"": ""1366 x 768 pixels"", ""Audio input compatible with the item"": ""USB, HDMI"", ""Audio output mode"": ""Digital"", ""Supported audio formats"": ""mp3, wav"", ""Speaker Surround Sound Channel Configuration"": ""2"", ""Video Capture Resolution"": ""720p"", ""Audio Wattage"": ""20 Watts"", ""Power Source"": ""AC"", ""Batteries Included"": ""No"", ""Batteries Required"": ""No"", ""GSM frequencies"": ""60 Hz"", ""Refresh Rate"": ""60 Hz"", ""Total USB ports"": ""2"", ""Connector Type"": ""Basic Smart"", ""Mounting Type"": ""Wall Mount"", ""Supports Bluetooth Technology"": ""No"", ""Country of Origin"": ""India"", ""Item Weight"": ""6 kg 960 g"", ""ASIN"": ""B0BRKKVSD7"", ""Best Sellers Rank"": ""#6,717 in Electronics (See Top 100 in Electronics)   #60 in Smart Televisions"", ""Date First Available"": ""12 September 2019"", ""Packer"": ""Innovative Technologies"", ""Item Dimensions LxWxH"": ""50 x 735 x 480 Millimeters"", ""Net Quantity"": ""1.00 count""}"
B0CG5STQFQ,Redmi Xiaomi 108 cm (43 inches) 4K Ultra HD Smart LED Fire TV L43R8-FVIN (Black),"23,999",950,4.2,https://m.media-amazon.com/images/I/81sQWfxGDRL._SL1500_.jpg,"[""https://m.media-amazon.com/images/I/81sQWfxGDRL._SL1500_.jpg"", ""https://m.media-amazon.com/images/I/71RX-BM1KCL._SL1500_.jpg"", ""https://m.media-amazon.com/images/I/81OF0L4Q68L._SL1500_.jpg"", ""https://m.media-amazon.com/images/I/81+utJ9gy+L._SL1500_.jpg"", ""https://m.media-amazon.com/images/I/81wgrRWTZML._SL1500_.jpg"", ""https://m.media-amazon.com/images/I/71rgUb8VHKL._SL1500_.jpg"", ""https://m.media-amazon.com/images/I/61nGHm3VLiL._SL1500_.jpg"", ""https://m.media-amazon.com/images/I/61NbMwwBROL._SL1500_.jpg"", ""https://m.media-amazon.com/images/I/71Z+2+y5PGL._SL1500_.jpg"", ""https://m.media-amazon.com/images/I/71YJjO1le0L._SL1500_.jpg"", ""https://m.media-amazon.com/images/I/81QtUuc7wcL._SL1500_.jpg"", ""https://m.media-amazon.com/images/I/71Suo03fqAL._SL1500_.jpg"", ""https://m.media-amazon.com/images/I/51gOdwTbmIL._SL1500_.jpg"", ""https://m.media-amazon.com/images/I/71+UeSBXB6L._SL1500_.jpg""]",,"['Resolution : 4K Ultra HD (3840 x 2160) | Refresh Rate : 60 Hertz', 'Connectivity: Dual Band Wi-Fi | 3 HDMI ports to connect latest gaming consoles, set top box, Blu-ray Players | 2 USB ports to connect hard drives and other USB devices | Bluetooth 5.0 | Optical | Ethernet | Earphone | AV', 'Sound: 24 Watts Output | Dolby Audio |DTS Virtual X, DTS-HD', 'Fire TV Built-In | Redmi Voice Remote with Alexa | Prime Video, Netflix, Disney+ Hotstar, YouTube, Jio Cinema, Sony LIV and 12000+ apps from Fire TV Appstore | Set-top-box Live TV Integration to switch between DTH TV channels and OTT apps seamlessly by just asking Alexa | Picture-in-Picture mode | Display Mirroring – Apple Airplay 2 & Miracast | Smart Home Dashboard | 2GB RAM + 8GB Storage | Metal Bezel-less Design', 'Display: 4K HDR | HDR10 | HLG | Vivid Picture Engine | DCI P3 90% (typ)', 'Recommendation: We recommend using 1.5V Alkaline AAA Batteries in your Alexa Voice Remote for a steady performance.', 'Warranty Information: 1 year comprehensive warranty on product and 1 year additional on Panel provided by the brand from the date of purchase']","{""Brand"": ""Redmi"", ""Manufacturer"": ""Xiaomi"", ""Model"": ""Redmi Fire TV Series"", ""Model Name"": ""Redmi Fire TV Series"", ""Model Year"": ""2023"", ""Product Dimensions"": ""24.14 x 95.72 x 60.71 cm; 6.95 kg"", ""Batteries"": ""2 AAA batteries required. (included)"", ""Item model number"": ""Redmi Fire TV Series"", ""Memory Storage Capacity"": ""8 GB"", ""Ram Memory Installed Size"": ""2 GB"", ""RAM memory maximum size"": ""2 GB"", ""Operating System"": ""FireOS"", ""Hardware Interface"": ""Bluetooth, USB, Ethernet, HDMI, 3.5mm Audio"", ""Graphics Coprocessor"": ""Mali G52 MC1"", ""Tuner Technology"": ""NTSC"", ""Response Time"": ""6.5 Milliseconds"", ""Resolution"": ""3840x2160 Pixels"", ""Special Features"": ""Fire TV Built-In | Redmi Voice Remote with Alexa | Prime Video, Netflix, Disney+ Hotstar, YouTube, Jio Cinema, Sony LIV and 12000+ apps from Fire TV Appstore | Set-top-box Live TV Integration to switch between DTH TV channels and OTT apps seamlessly by just asking Alexa | Picture-in-Picture mode | Display Mirroring \u2013 Apple Airplay 2 & Miracast | Smart Home Dashboard | 2GB RAM + 8GB Storage | Metal Bezel-less Design"", ""Mounting Hardware"": ""1 LED TV, 1 Remote Control, 1 Manual, 2 Stands Unit, 4 Screws, 2 x AAA batteries"", ""Number of items"": ""1"", ""Remote Control Description"": ""One Click Prime Video, Amazon Music, Netflix | Alexa Voice Assistant"", ""Remote control technology"": ""IR, Bluetooth"", ""Display Technology"": ""LED"", ""Standing screen display size"": ""43 Inches"", ""Display Type"": ""HDR 10 |HLG"", ""Colour Screen"": ""Yes"", ""Viewing Angle"": ""178 Degrees"", ""Image Aspect Ratio"": ""16:09"", ""Image contrast ratio"": ""5000:1"", ""Supported image types"": ""GIF, PNG"", ""Aspect Ratio"": ""16:9"", ""Screen Resolution"": ""3840 x 2160 pixels"", ""Audio input compatible with the item"": ""Auxiliary"", ""Audio output mode"": ""Stereo"", ""Supported audio formats"": ""mp3_audio, wma"", ""Speaker Surround Sound Channel Configuration"": ""Dolby Audio"", ""Speakers Maximum Output Power"": ""24 Watts"", ""Audio Wattage"": ""24 Watts"", ""Voltage"": ""100 Volts"", ""Wattage"": ""24 Watts"", ""Power Source"": ""AC"", ""Battery Description"": ""1.5V Alkaline AAA"", ""Batteries Included"": ""Yes"", ""Batteries Required"": ""Yes"", ""Battery cell composition"": ""Alkaline"", ""GSM frequencies"": ""60 Hz"", ""Refresh Rate"": ""60 Hz"", ""Total USB ports"": ""2"", ""Connector Type"": ""Wi-Fi, USB, Ethernet, HDMI"", ""Maximum Operating Distance"": ""9 Feet"", ""Mounting Type"": ""Wall Mount & Table Mount"", ""Actual viewing angle"": ""178 Degrees"", ""Media Format"": ""AVI, MPEG"", ""Includes Rechargeable Battery"": ""No"", ""Includes remote"": ""Yes"", ""Supports Bluetooth Technology"": ""Yes"", ""Country of Origin"": ""India"", ""Item Weight"": ""6 kg 950 g"", ""ASIN"": ""B0CG5STQFQ"", ""Best Sellers Rank"": ""#1,025 in Electronics (See Top 100 in Electronics)   #9 in Smart Televisions"", ""Date First Available"": ""21 August 2023"", ""Packer"": ""TTE Electronics India Private Limited, Vikruthamala Village, Papanaidupeta Post, Yerpedu Mandal, Tirupati, Vikruthamala Village, Chitt oor, Andhra Pradesh, 517526"", ""Item Dimensions LxWxH"": ""24.1 x 95.7 x 60.7 Centimeters"", ""Net Quantity"": ""1 Count"", ""Generic Name"": ""TV""}"
B0D3DZ1SPM,Sony BRAVIA 2 Series 108 cm (43 inches) 4K Ultra HD Smart LED Google TV K-43S20B (Black),"40,990",743,4.7,https://m.media-amazon.com/images/I/81BENnbPpuL._SL1500_.jpg,"[""https://m.media-amazon.com/images/I/81BENnbPpuL._SL1500_.jpg"", ""https://m.media-amazon.com/images/I/81gLIG8BoGL._SL1500_.jpg"", ""https://m.media-amazon.com/images/I/81P2-OslN1L._SL1500_.jpg"", ""https://m.media-amazon.com/images/I/81wyAVPzpRL._SL1500_.jpg"", ""https://m.media-amazon.com/images/I/81iQB3FgnQL._SL1500_.jpg"", ""https://m.media-amazon.com/images/I/61AI3Hmt3tL._SL1500_.jpg"", ""https://m.media-amazon.com/images/I/6135AEbAuuL._SL1500_.jpg"", ""https://m.media-amazon.com/images/I/717uvYatRhL._SL1500_.jpg"", ""https://m.media-amazon.com/images/I/91PjYqTO6RL._SL1500_.jpg"", ""https://m.media-amazon.com/images/I/81qQBBqSM1L._SL1500_.jpg"", ""https://m.media-amazon.com/images/I/81BGv0z2e4L._SL1500_.jpg"", ""https://m.media-amazon.com/images/I/81pw5A1ZYuL._SL1500_.jpg"", ""https://m.media-amazon.com/images/I/71iz85kWxXL._SL1500_.jpg"", ""https://m.media-amazon.com/images/I/71IBUSQnk6S._SL1500_.jpg"", ""https://m.media-amazon.com/images/I/71Wiik6saaL._SL1200_.jpg"", ""https://m.media-amazon.com/images/I/717MQvuYIuL._SL1500_.jpg"", ""https://m.media-amazon.com/images/I/81yjFswtdcL._SL1500_.jpg"", ""https://m.media-amazon.com/images/I/61y6LeMX5WL._SL1200_.jpg"", ""https://m.media-amazon.com/images/I/71vvsrA0WUL._SL1500_.jpg"", ""https://m.media-amazon.com/images/I/81C61R2a9wL._SL1500_.jpg""]",,"['Resolution: 4K Ultra HD (3840 x 2160) | Refresh Rate: 60 hertz | BRAVIA 2 LED', 'Connectivity: 3 HDMI ports to connect set top box, Blu Ray players, gaming console | 1 USB ports to connect hard drives or other USB devices', 'Sound : 20 Watts Output | 2ch |Open Baffle Speaker | Dolby Atmos | Ambient Optimization |2 Full Range (44.5 x 106mm)| 2 Subwoofers', 'Smart TV Features: Google TV | Watchlist | Google Assistant | Chromecast Built In | Built In Mic | Game menu | ALLM/eARC (HDMI 2.1 Compatible) | Additional Features: Apple Airplay | Apple Homekit | Alexa', 'Display : 4K LED | 4K Processor X1 | Live Color | 4K X-Reality PRO | MotionFlow XR 100 | HDR10/HLG', '1 year warranty provided by the manufacturer from date of purchase']","{""Brand"": ""Sony"", ""Manufacturer"": ""SONY"", ""Model"": ""K-43S20B"", ""Model Name"": ""K-43S20B"", ""Model Year"": ""2024"", ""Product Dimensions"": ""7.7 x 97.1 x 57.5 cm; 7.8 kg"", ""Batteries"": ""2 AAA batteries required. (included)"", ""Item model number"": ""K-43S20B"", ""Operating System"": ""Google TV"", ""Hardware Interface"": ""Bluetooth, USB, HDMI"", ""Graphics Coprocessor"": ""4K Processor X1"", ""Tuner Technology"": ""DVB-T"", ""Resolution"": ""3840x2160 Pixels"", ""Compatible Devices"": ""Laptop, Gaming Console, Headphone, Smartphone, Speaker"", ""Special Features"": ""Smart TV Features: Google TV | Watchlist | Google Assistant | Chromecast Built In | Built In Mic | Game menu | ALLM/eARC (HDMI 2.1 Compatible) | Additional Features: Apple Airplay | Apple Homekit | Alexa"", ""Mounting Hardware"": ""1 LED TV, 1 Warranty Card, 1 AC Power Adapter, 1 AC Power Cord, 1 Standard Remote, 1 Quick Setup Guide, 2 AAA Batteries"", ""Number of items"": ""1"", ""Remote Control Description"": ""One Click Google Assistant | Youtube | Netflix | Youtube Music | Prime Video"", ""Remote control technology"": ""IR, Bluetooth"", ""Display Technology"": ""LED"", ""Standing screen display size"": ""43 Inches"", ""Display Type"": ""4K HDR"", ""Colour Screen"": ""Yes"", ""Viewing Angle"": ""178 Degrees"", ""Image Aspect Ratio"": ""16:09"", ""Image contrast ratio"": ""4000:1"", ""Supported image types"": ""GIF, JPEG"", ""Aspect Ratio"": ""16:9"", ""Audio input compatible with the item"": ""Auxiliary"", ""Audio output mode"": ""Surround"", ""Supported audio formats"": ""mp3_audio, wma"", ""Speaker Surround Sound Channel Configuration"": ""Dolby Audio"", ""Speakers Maximum Output Power"": ""20 Watts"", ""Audio Wattage"": ""20 Watts"", ""Voltage"": ""240 Volts"", ""Wattage"": ""106 Watts"", ""Power Source"": ""AC"", ""Battery Description"": ""Alkaline"", ""Batteries Included"": ""Yes"", ""Batteries Required"": ""Yes"", ""Battery cell composition"": ""Alkaline"", ""Refresh Rate"": ""60 Hz"", ""Total USB ports"": ""1"", ""Connector Type"": ""Wi-Fi, USB, Ethernet, HDMI"", ""Maximum Operating Distance"": ""6 Feet"", ""Mounting Type"": ""Wall Mount & Table Mount"", ""Actual viewing angle"": ""178 Degrees"", ""Media Format"": ""AVI, MPEG"", ""Includes Rechargeable Battery"": ""Yes"", ""Includes remote"": ""Yes"", ""Supports Bluetooth Technology"": ""Yes"", ""Country of Origin"": ""India"", ""Item Weight"": ""7 kg 800 g"", ""ASIN"": ""B0D3DZ1SPM"", ""Best Sellers Rank"": ""#2,915 in Electronics (See Top 100 in Electronics)   #31 in Smart Televisions"", ""Date First Available"": ""17 June 2024"", ""Packer"": ""\u200eSony India Private Limited, Sony India Private Limited, A-18, Mohan Co-operative Industrial Estate, Mathura Road, New Delhi 110044, India , Toll Free: 1800-103-7799, Email: Sonyindia.care@ap.sony.com, Visit sonyindia.co.in for product recycling"", ""Item Dimensions LxWxH"": ""7.7 x 97.1 x 57.5 Centimeters"", ""Net Quantity"": ""1 Piece"", ""Generic Name"": ""TV""}"
B0C1HCS2WZ,Sony Bravia 164 cm (65 inches) 4K Ultra HD Smart LED Google TV KD-65X74L (Black),"76,490",16967,4.8,https://m.media-amazon.com/images/I/81MRU+3RJLL._SL1500_.jpg,"[""https://m.media-amazon.com/images/I/81MRU+3RJLL._SL1500_.jpg"", ""https://m.media-amazon.com/images/I/81PT+bs5-iL._SL1500_.jpg"", ""https://m.media-amazon.com/images/I/81N4+wEy+kL._SL1500_.jpg"", ""https://m.media-amazon.com/images/I/81h4sLxAesL._SL1500_.jpg"", ""https://m.media-amazon.com/images/I/81FhEVavfZL._SL1500_.jpg"", ""https://m.media-amazon.com/images/I/61s0PxX+ymL._SL1500_.jpg"", ""https://m.media-amazon.com/images/I/712vrBb9UTL._SL1500_.jpg"", ""https://m.media-amazon.com/images/I/91saR2ZPHZL._SL1500_.jpg"", ""https://m.media-amazon.com/images/I/91xVl9TLiWL._SL1500_.jpg"", ""https://m.media-amazon.com/images/I/81rm-Bm6lVL._SL1500_.jpg"", ""https://m.media-amazon.com/images/I/81pw5A1ZYuL._SL1500_.jpg"", ""https://m.media-amazon.com/images/I/71IBUSQnk6S._SL1500_.jpg"", ""https://m.media-amazon.com/images/I/81P-kdbCalL._SL1500_.jpg"", ""https://m.media-amazon.com/images/I/91DpE6LmvUL._SL1500_.jpg"", ""https://m.media-amazon.com/images/I/71X6M110XzL._SL1500_.jpg"", ""https://m.media-amazon.com/images/I/81QIHMK87DL._SL1500_.jpg"", ""https://m.media-amazon.com/images/I/81ifaXctZ2L._SL1500_.jpg""]",,"['Resolution: 4K Ultra HD (3840 x 2160) | Refresh Rate: 60 Hertz | 178 Degree wide viewing angle', 'Connectivity: 3 HDMI ports to connect set top box, Blu Ray players, gaming console | 2 USB ports to connect hard drives and other USB devices', 'Sound : 20 Watts Output | Open Baffle Speaker| Dolby Audio | Clear Phase | eARC Input', 'Smart TV Features: Google TV, Watchlist, Voice Search, Google Play, Chromecast Built-In, Netflix, Amazon Prime Video, Additional Features: Apple Airplay, Apple Homekit, Alexa | Supported Apps: Netflix, Amazon Prime Video, Disney+ Hotstar, Sony Liv, Zee5, Voot, Jio Cinema & many More', 'Display: X1 4K Processor | 4K HDR | Live Colour| 4K X Reality Pro | Motion Flow XR100', 'Warranty Information: 1 year comprehensive warranty on product provided by the brand from the date of purchase']","{""Brand"": ""Sony"", ""Manufacturer"": ""Sony"", ""Model"": ""KD-65X74L"", ""Model Name"": ""KD-65X74L"", ""Model Year"": ""2023"", ""Product Dimensions"": ""8.7 x 146.3 x 85.2 cm; 21.4 kg"", ""Batteries"": ""2 AAA batteries required. (included)"", ""Item model number"": ""KD-65X74L"", ""Operating System"": ""Google TV"", ""Processor Count"": ""1"", ""Hardware Interface"": ""Bluetooth, USB, Ethernet, HDMI, Composite Video"", ""Graphics Coprocessor"": ""X1 4K Processor"", ""Tuner Technology"": ""DVB-T/T2"", ""Resolution"": ""3840x2160 Pixels"", ""Compatible Devices"": ""Android Phone, Home Theatre"", ""Special Features"": ""Google TV, Watchlist, Voice Search, Google Play, Chromecast, Netflix, Amazon Prime Video, Additional Features: Apple Airplay, Apple Homekit, Alexa"", ""Mounting Hardware"": ""1 LED TV, 1 AC Power Cord, 1 Remote Control, 1 Table-Top Stand, 1 User Manual, 2 AAA Batteries"", ""Number of items"": ""1"", ""Remote Control Description"": ""One Click Google Assistant | Youtube | Netflix | Youtube Music | Prime Video"", ""Remote control technology"": ""IR, Bluetooth"", ""Display Technology"": ""LED"", ""Standing screen display size"": ""65 Inches"", ""Display Type"": ""4K HDR"", ""Colour Screen"": ""Yes"", ""Viewing Angle"": ""178 Degrees"", ""Image Aspect Ratio"": ""16:09"", ""Supported image types"": ""TIFF, JPEG"", ""Aspect Ratio"": ""16:9"", ""Screen Resolution"": ""3840 x 2160 pixel"", ""Audio input compatible with the item"": ""Auxiliary"", ""Audio output mode"": ""Surround"", ""Supported audio formats"": ""mp3_audio, wma"", ""Speaker Surround Sound Channel Configuration"": ""Dolby Audio"", ""Audio Wattage"": ""20 Watts"", ""Voltage"": ""240 Volts"", ""Wattage"": ""180 Watts"", ""Power Source"": ""AC"", ""Battery Description"": ""2 AAA batteries"", ""Batteries Included"": ""Yes"", ""Batteries Required"": ""Yes"", ""Battery cell composition"": ""Alkaline"", ""GSM frequencies"": ""60 Hz"", ""Refresh Rate"": ""60 Hz"", ""Total USB ports"": ""2"", ""Connector Type"": ""Wi-Fi, USB, Ethernet, HDMI"", ""Maximum Operating Distance"": ""3.5 Feet"", ""Mounting Type"": ""Wall Mount & Table Mount"", ""Actual viewing angle"": ""178 Degrees"", ""Media Format"": ""AVI, MPEG"", ""Includes Rechargeable Battery"": ""No"", ""Includes remote"": ""Yes"", ""Supports Bluetooth Technology"": ""Yes"", ""Country of Origin"": ""India"", ""Item Weight"": ""21 kg 400 g"", ""ASIN"": ""B0C1HCS2WZ"", ""Best Sellers Rank"": ""#4,303 in Electronics (See Top 100 in Electronics)   #46 in Smart Televisions"", ""Date First Available"": ""5 April 2023"", ""Packer"": ""Sony India Private Limited, Sony India Private Limited, A-18, Mohan Co-operative Industrial Estate, Mathura Road, New Delhi 110044, India , Toll Free: 1800-103-7799, Email: Sonyindia.care@ap.sony.com, Visit sonyindia.co.in for product recycling"", ""Item Dimensions LxWxH"": ""8.7 x 146.3 x 85.2 Centimeters"", ""Net Quantity"": ""1 Piece"", ""Generic Name"": ""Television""}"
B0D1V9YCXS,Toshiba 126 cm (50 inches) 4K Ultra HD Smart QLED TV 50C450ME (Silver),"34,999",2192,4.3,https://m.media-amazon.com/images/I/813dl9fPaxL._SL1500_.jpg,"[""https://m.media-amazon.com/images/I/813dl9fPaxL._SL1500_.jpg"", ""https://m.media-amazon.com/images/I/81Z+XYUR8IL._SL1500_.jpg"", ""https://m.media-amazon.com/images/I/71osMLNh7IL._SL1500_.jpg"", ""https://m.media-amazon.com/images/I/711uKpaVOhL._SL1500_.jpg"", ""https://m.media-amazon.com/images/I/71DZ9TUQz-L._SL1500_.jpg"", ""https://m.media-amazon.com/images/I/71P08CcqRvL._SL1500_.jpg"", ""https://m.media-amazon.com/images/I/61vp9xcQftL._SL1500_.jpg"", ""https://m.media-amazon.com/images/I/810souRGcyL._SL1500_.jpg"", ""https://m.media-amazon.com/images/I/51JLfKYPzsL._SL1500_.jpg"", ""https://m.media-amazon.com/images/I/71A+kFp4noL._SL1500_.jpg"", ""https://m.media-amazon.com/images/I/819yXlNLz6L._SL1500_.jpg"", ""https://m.media-amazon.com/images/I/81iJp+4PwCL._SL1500_.jpg"", ""https://m.media-amazon.com/images/I/71sV0s4oR7L._SL1500_.jpg"", ""https://m.media-amazon.com/images/I/714DwcPRulL._SL1500_.jpg"", ""https://m.media-amazon.com/images/I/91-wRcYwcKL._SL1500_.jpg"", ""https://m.media-amazon.com/images/I/81bPAnqb6aL._SL1500_.jpg"", ""https://m.media-amazon.com/images/I/81lYCpdA5HL._SL1500_.jpg""]",,"['Resolution: 4K Ultra HD (3840 x 2160) QLED TV | Refresh Rate: 60 hertz | HDR game mode with ALLM VRR Supported | Bezel-less Design', 'Connectivity: 3 HDMI ports to connect set top box (HDMI 1 eARC supported) | 2 USB ports to connect hard drives and other USB devices | Built- in WiFi | Bluetooth 4.2 | Ethernet RJ45 | 3.5mm earphone Jack', 'Sound: 24 Watts Audio Output | Dobly Atoms | Dolby MS12 Sound Processing | User Equalizer | MPEG-H Audio', 'Smart TV Features: Vidaa TV | Amazon Alexa | Built-in Vidaa Voice Control and Voice Assistant | Screen Sharing | Airplay | Built-in Amazon Alexa | Auto Low Latency Mode for VRR | AI Picture Quality | Supported Apps: Netflix, YouTube, Prime Video, Disney+Hotstar, SonyLiv, Hungama, JioCinema, Zee5, Eros Now', 'Display: Quantum Dot Technology | Wide Color Gamut | 8 Bit Color Depth | 3000:1 Native Contrast Ratio | 3D Digital Comb Filter | MPEG and Mosquito noise reduction | 4K upscaling Picture Quality Enhancement | Dolby Vision | HDR 10+ Decoding', 'Warranty Information: 2 Year Comprehensive Warranty on product provided by Toshiba from date of purchase.']","{""Brand"": ""TOSHIBA"", ""Manufacturer"": ""\u200eDIXON TECHNOLOGY (INDIA) LIMITED"", ""Model"": ""50C450ME"", ""Model Name"": ""50C450ME"", ""Model Year"": ""2024"", ""Product Dimensions"": ""7.4 x 111.7 x 64.4 cm; 8.8 kg"", ""Item model number"": ""50C450ME"", ""Memory Storage Capacity"": ""4 GB"", ""Ram Memory Installed Size"": ""1.5 GB"", ""Operating System"": ""VIDAA"", ""Hardware Interface"": ""Bluetooth, USB, Ethernet, HDMI, 3.5mm Audio"", ""Graphics Coprocessor"": ""REGZA Engine ZR"", ""Tuner Technology"": ""DVB-T2/T/C/S2/S"", ""Response Time"": ""8 Milliseconds"", ""Resolution"": ""3840x2160 Pixels"", ""Special Features"": ""4K upscaling | Game Mode Plus | Auto Low Latency Mode | Dobly Vision and Dobly Atoms | AI PQ | Voice Assistant | Airplay | Supported Apps : Netflix, Youtube, Prime Video, Disney+Hotstar, SonyLiv, JioCinema, Zee5, Eros Now"", ""Mounting Hardware"": ""\u200e\u200e1 TV Unit, 1 Remote, 2 Table Stand, 1 User Manual, 2 Batteries, 1 Warranty Card"", ""Number of items"": ""1"", ""Remote Control Description"": ""One touch access to you\u2019re your favourite OTT Apps"", ""Remote control technology"": ""Bluetooth"", ""Display Technology"": ""QLED"", ""Standing screen display size"": ""50 Inches"", ""Display Type"": ""VA"", ""Viewing Angle"": ""178 Degrees"", ""Image Aspect Ratio"": ""16:09"", ""Image brightness"": ""High Brightness"", ""Image contrast ratio"": ""3000:1"", ""Supported image types"": ""GIF, JPEG"", ""Aspect Ratio"": ""16:9"", ""Audio input compatible with the item"": ""Auxiliary"", ""Audio output mode"": ""Stereo"", ""Supported audio formats"": ""mp3_audio, wma"", ""Speaker Surround Sound Channel Configuration"": ""Dolby Atmos"", ""Speakers Maximum Output Power"": ""24 Watts"", ""Audio Wattage"": ""24 Watts"", ""Voltage"": ""240 Volts"", ""Wattage"": ""130 Watts"", ""Power Source"": ""AC"", ""Batteries Included"": ""Yes"", ""Batteries Required"": ""Yes"", ""Battery cell composition"": ""Alkaline"", ""Refresh Rate"": ""60 Hz"", ""Total USB ports"": ""2"", ""Connector Type"": ""Wi-Fi, USB, Ethernet, HDMI"", ""Maximum Operating Distance"": ""30 Feet"", ""Mounting Type"": ""Wall Mount & Table Mount"", ""Actual viewing angle"": ""178 Degrees"", ""Media Format"": ""AVI, MPEG"", ""Includes Rechargeable Battery"": ""No"", ""Includes remote"": ""Yes"", ""Supports Bluetooth Technology"": ""Yes"", ""Country of Origin"": ""India"", ""Item Weight"": ""8 kg 800 g"", ""ASIN"": ""B0D1V9YCXS"", ""Best Sellers Rank"": ""#13,759 in Electronics (See Top 100 in Electronics)   #103 in Smart Televisions"", ""Date First Available"": ""16 April 2024"", ""Packer"": ""Bhagwati Products Ltd., Plot No. S-1, E-City, Fabcity, Raviryala(V), Maheshwaram(M), Ranga Reddy(Dist.), Telangana State, INDIA - 501510."", ""Item Dimensions LxWxH"": ""7.4 x 111.7 x 64.4 Centimeters"", ""Net Quantity"": ""1 Set"", ""Generic Name"": ""Smart TV""}"
