asin,title,price,num_of_ratings,average_rating,main_image,all_images,product_description,about_product,product_information
B09Y66S2J8,Samsung 138 cm (55 inches) 4K Ultra HD Smart NEO QLED TV QA55QN85BAKLXL (Bright Silver),"99,990",24,3.8,https://m.media-amazon.com/images/I/91SbADaGCbL._SL1500_.jpg,"[""https://m.media-amazon.com/images/I/91SbADaGCbL._SL1500_.jpg"", ""https://m.media-amazon.com/images/I/81yuzCbBk1L._SL1500_.jpg"", ""https://m.media-amazon.com/images/I/71Qm5xi6YkL._SL1500_.jpg"", ""https://m.media-amazon.com/images/I/61JwStHGsKL._SL1500_.jpg"", ""https://m.media-amazon.com/images/I/612gnZKCzEL._SL1500_.jpg"", ""https://m.media-amazon.com/images/I/71PjMRWJ9JL._SL1500_.jpg"", ""https://m.media-amazon.com/images/I/61M0iV++ZbS._SL1500_.jpg"", ""https://m.media-amazon.com/images/I/91HZSZiaZ5L._SL1500_.jpg"", ""https://m.media-amazon.com/images/I/61sWu+glkeL._SL1500_.jpg"", ""https://m.media-amazon.com/images/I/51DfrJU7s6L._SL1500_.jpg"", ""https://m.media-amazon.com/images/I/71j9hai1XaL._SL1500_.jpg"", ""https://m.media-amazon.com/images/I/91TYDQt3mFL._SL1500_.jpg""]",,"['Resolution : 4K Ultra HD (3840 x 2160) | Refresh Rate : 100 Hertz | NEO QLED Panel;Connectivity: 4 HDMI ports to connect set top box, Blu-ray speakers or a gaming console | 2 USB ports to connect hard drives or other USB devices; Sound: 60 Watts Output - 2.2.2 Ch| Powerful Speakers with Dolby Digital Plus | Surround Sound | Active Voice Amplifier | Adaptive Sound+', 'Smart TV Features : Mirroring | Tap View |Multi-View | Music Wall | Mobile Camera Support | Wireless Dex | Auto Game Mode (ALLM) | Game Motion Plus | Dynamic Black EQ | Surround Sound | Super Ultra Wide Game View |Mini Map Zoom, FreeSync Premium Pro', 'Display: One Billion Color | PQI 4300 | 100% Colour Volume with Quantum Dot | Wide Viewing Angle | AI Upscale | Quantum Processor 4K | Motion Xcelerator Turbo+ | AI Upscale | Certified(HDR10+ Adaptive & HDR10+ GAMING)', 'Warranty Information: 2 year comprehensive warranty on product (1 year standard warranty and 1 years extended warranty provided by the brand from the date of purchase)', 'Memory Storage Capacity: 8 GB; Connector Type: Hdmi, USB']","{""Brand"": ""Samsung"", ""Manufacturer"": ""Samsung India Pvt Ltd"", ""Model"": ""QA55QN85BAKLXL"", ""Model Name"": ""QA55QN85BAKLXL"", ""Model Year"": ""2022"", ""Product Dimensions"": ""112 x 2.57 x 64.41 cm; 20.2 kg"", ""Item model number"": ""QA55QN85BAKLXL"", ""Memory Storage Capacity"": ""8 GB"", ""Ram Memory Installed Size"": ""2.5 GB"", ""Operating System"": ""Tizen"", ""Hardware Interface"": ""Bluetooth, USB, HDMI"", ""Graphics Coprocessor"": ""Neo Quantum Processor 4K"", ""Tuner Technology"": ""DVB-T"", ""Resolution"": ""3840x2160 Pixels"", ""Special Features"": ""DLNA Mirroring Tap View ,Multi-View , Wireless Dex , Auto Game Mode (ALLM) , Game Motion Plus , Dynamic Black EQ , Surround Sound , Super Ultra Wide Game View ,, FreeSync Premium Pro"", ""Mounting Hardware"": ""1 LED TV, 1 Power Cord, 1 Remote control, 2 Stand-Top (Table Top will be Provided at the time on installation)"", ""Number of items"": ""1"", ""Remote Control Description"": ""Voice Assistant Key | Hotkey for Prime Video, Netflix and Zee5"", ""Remote control technology"": ""Bluetooth"", ""Display Technology"": ""QLED"", ""Standing screen display size"": ""55 Inches"", ""Display Type"": ""HDR 10+"", ""Viewing Angle"": ""178 Degrees"", ""Image Aspect Ratio"": ""16:09"", ""Supported image types"": ""GIF, JPEG"", ""Screen Resolution"": ""3840 x 2160 pixels"", ""Audio input compatible with the item"": ""Auxiliary"", ""Audio output mode"": ""Surround"", ""Supported audio formats"": ""mp3_audio, wma"", ""Speaker Surround Sound Channel Configuration"": ""Dolby Digital Plus"", ""Video Capture Resolution"": ""4K"", ""Audio Wattage"": ""60 Watts"", ""Voltage"": ""200 Volts"", ""Wattage"": ""60 Watts"", ""Power Source"": ""AC"", ""Batteries Included"": ""No"", ""Batteries Required"": ""No"", ""GSM frequencies"": ""100 Hz"", ""Refresh Rate"": ""100 Hz"", ""Total USB ports"": ""2"", ""Connector Type"": ""Wi-Fi, USB, Ethernet, HDMI"", ""Maximum Operating Distance"": ""18 Feet"", ""Mounting Type"": ""Wall Mount"", ""Actual viewing angle"": ""178 Degrees"", ""Includes remote"": ""Yes"", ""Supports Bluetooth Technology"": ""Yes"", ""Country of Origin"": ""India"", ""Item Weight"": ""20 kg 200 g"", ""ASIN"": ""B09Y66S2J8"", ""Best Sellers Rank"": ""#95,310 in Electronics (See Top 100 in Electronics)   #334 in Smart Televisions"", ""Date First Available"": ""18 April 2022"", ""Packer"": ""Samsung India Pvt Ltd, 180040 7267864 , 1800 5 7267864"", ""Importer"": ""Samsung India Pvt Ltd, 180040 7267864 , 1800 5 7267864"", ""Item Dimensions LxWxH"": ""112 x 2.6 x 64.4 Centimeters"", ""Net Quantity"": ""1 Piece"", ""Generic Name"": ""Television""}"
B0CZLLPXRJ,TCL 108 cm (43 inches) 4K Ultra HD Smart QLED Google TV 43C61B (Black),"28,990",2300,4,https://m.media-amazon.com/images/I/71gRxd+n0HL._SL1500_.jpg,"[""https://m.media-amazon.com/images/I/71gRxd+n0HL._SL1500_.jpg"", ""https://m.media-amazon.com/images/I/81AybdVQJiL._SL1500_.jpg"", ""https://m.media-amazon.com/images/I/71IU9StEAQL._SL1500_.jpg"", ""https://m.media-amazon.com/images/I/71WVlyLtXWL._SL1500_.jpg"", ""https://m.media-amazon.com/images/I/81bow3FHhXL._SL1500_.jpg"", ""https://m.media-amazon.com/images/I/81xuvs7HaPL._SL1500_.jpg"", ""https://m.media-amazon.com/images/I/81P81kcijVL._SL1500_.jpg"", ""https://m.media-amazon.com/images/I/81nbIRFc1XL._SL1500_.jpg"", ""https://m.media-amazon.com/images/I/61DcsFuo9tL._SL1500_.jpg"", ""https://m.media-amazon.com/images/I/51zYptYEJFL._SL1500_.jpg"", ""https://m.media-amazon.com/images/I/719JpMuVILL._SL1500_.jpg"", ""https://m.media-amazon.com/images/I/61H7GXcXPAL._SL1500_.jpg"", ""https://m.media-amazon.com/images/I/51gHvV5-a7L._SL1500_.jpg"", ""https://m.media-amazon.com/images/I/71IEYeKjyDL._SL1500_.jpg"", ""https://m.media-amazon.com/images/I/71WSvLt-r6L._SL1500_.jpg"", ""https://m.media-amazon.com/images/I/610F5sRKu2L._SL1500_.jpg"", ""https://m.media-amazon.com/images/I/41a-qB6XBDL._SL1500_.jpg"", ""https://m.media-amazon.com/images/I/51IYxw7PJ4L._SL1500_.jpg""]",,"['Resolution: 4K Ultra HD (3840 x 2160) | Refresh Rate: 60 Hertz', 'Connectivity: 3 HDMI Ports to connect set top box, Blu Ray players, gaming console | 1 USB ports to connect hard drive or other USB device | Ethernet | Wi-fi | Bluetooth | 1 Headphone output', 'Sound: 30 Watts Output | DTS Virtual:X &Dolby Atmos Audio System', 'Smart TV Features: Google TV | Web Browser| Multi View | Mobile to TV Mirroring | TV initiate mirroring |Wireless TV On | 2 GB RAM+32 GB ROM|Multiple Eye Care | T-Screen Pro| Multiple Eye Care | DTS Virtual:X |Hands Free Voice Control', 'Display: QLED Pro TV| Google TV| Dolby Vision -Atmos | HDR 10+ |AiPQ Pro Processor| T-SCREEN- PRO|Slim and Uni-Body Design |MEMC', 'Warranty Information: 2 Year warranty provided by the manufacturer from date of purchase']","{""Brand"": ""TCL"", ""Manufacturer"": ""TCL India"", ""Model"": ""43C61B"", ""Model Name"": ""43C61B"", ""Model Year"": ""2024"", ""Product Dimensions"": ""18.5 x 95.6 x 60 cm; 6.7 kg"", ""Batteries"": ""2 AAA batteries required. (included)"", ""Item model number"": ""43C61B"", ""Memory Storage Capacity"": ""32 GB"", ""Ram Memory Installed Size"": ""2 GB"", ""Operating System"": ""Google TV"", ""Hardware Interface"": ""Bluetooth, USB, Ethernet"", ""Graphics Coprocessor"": ""Mali G57 MC1 800MHz"", ""Tuner Technology"": ""DVB-T2"", ""Response Time"": ""9.5 Milliseconds"", ""Resolution"": ""3840x2160 Pixels"", ""Special Features"": ""QLED TV, Google TV, Dolby Vision -Atmos, HDR 10+, AiPQ Pro Processor, T-SCREEN- PRO, Slim and Uni-Body Design, MEMC, 2 GB RAM+32 GB ROM, Multiple Eye Care, ONKYO 2.1 CH, T-Screen Pro, Multiple Eye Care, DTS Virtual:X, Hands Free Voice Control"", ""Mounting Hardware"": ""1N LED TV, 1N Audio Cable, 1N Stand, 1N User Manual, 1N Warranty Card, 1N Remote Control, 2N Batteries"", ""Number of items"": ""8"", ""Remote Control Description"": ""Smart remote with Dedicated Hotkeys for quick and easy access"", ""Remote control technology"": ""IR, Bluetooth"", ""Display Technology"": ""QLED"", ""Standing screen display size"": ""43 Inches"", ""Display Type"": ""HDR 10+"", ""Viewing Angle"": ""178 Degrees"", ""Image Aspect Ratio"": ""16:09"", ""Image brightness"": ""High Brightness"", ""Image contrast ratio"": ""5000:1"", ""Supported image types"": ""PNG, JPEG"", ""Aspect Ratio"": ""16:9"", ""Screen Resolution"": ""3840 x 2160 pixel"", ""Audio input compatible with the item"": ""Auxiliary"", ""Audio output mode"": ""Surround"", ""Supported audio formats"": ""mp3_audio, wma"", ""Speaker Surround Sound Channel Configuration"": ""Dolby Atmos"", ""Speakers Maximum Output Power"": ""30 Watts"", ""Audio Wattage"": ""30 Watts"", ""Voltage"": ""240 Volts"", ""Wattage"": ""130 Watts"", ""Power Source"": ""AC"", ""Batteries Included"": ""Yes"", ""Batteries Required"": ""Yes"", ""Battery cell composition"": ""Alkaline"", ""Refresh Rate"": ""60 Hz"", ""Total USB ports"": ""1"", ""Connector Type"": ""Wi-Fi, USB, Ethernet, HDMI"", ""Maximum Operating Distance"": ""9 Feet"", ""Mounting Type"": ""Wall Mount & Table Mount"", ""Actual viewing angle"": ""178 Degrees"", ""Media Format"": ""MPEG, AVI"", ""Includes Rechargeable Battery"": ""No"", ""Includes remote"": ""Yes"", ""Supports Bluetooth Technology"": ""Yes"", ""Country of Origin"": ""India"", ""Item Weight"": ""6 kg 700 g"", ""ASIN"": ""B0CZLLPXRJ"", ""Best Sellers Rank"": ""#3,144 in Electronics (See Top 100 in Electronics)   #32 in Smart Televisions"", ""Date First Available"": ""1 April 2024"", ""Packer"": ""TTE ELECTRONICS INDIA PRIVATE LIMITED, Vikruthamala Village, Papanaidupeta Post, Yerpedu Mandal, Tirupati, Vikruthamala Village, Chittoor, Andhra Pradesh, INDIA-517526"", ""Importer"": ""TTE ELECTRONICS INDIA PRIVATE LIMITED, Vikruthamala Village, Papanaidupeta Post, Yerpedu Mandal, Tirupati, Vikruthamala Village, Chittoor, Andhra Pradesh, INDIA-517526"", ""Item Dimensions LxWxH"": ""18.5 x 95.6 x 60 Centimeters"", ""Generic Name"": ""Smart TV""}"
B0CQ7XYNPG,Blaupunkt 101 cm (40 inches) Cyber Sound G2 Series Full HD LED Google TV 40CSG7112 (Black),"15,999",770,4.3,https://m.media-amazon.com/images/I/713-2SMVZ4L._SL1500_.jpg,"[""https://m.media-amazon.com/images/I/713-2SMVZ4L._SL1500_.jpg"", ""https://m.media-amazon.com/images/I/713-2SMVZ4L._SL1500_.jpg"", ""https://m.media-amazon.com/images/I/518mrO08JuL._SL1500_.jpg"", ""https://m.media-amazon.com/images/I/71eERty9QBL._SL1500_.jpg"", ""https://m.media-amazon.com/images/I/610j7d6+MUL._SL1500_.jpg"", ""https://m.media-amazon.com/images/I/71SU-X16onL._SL1500_.jpg"", ""https://m.media-amazon.com/images/I/316-unnAjvL.jpg"", ""https://m.media-amazon.com/images/I/51tOkZ7j-UL._SL1500_.jpg""]",,"['Resolution : Full HD (1920 x 1080)| Refresh Rate : 60 Hertz', 'Connectivity: Dual Band Wi-Fi | 3 HDMI ports to connect latest gaming consoles, set top box, Blu-ray Players | 2 USB ports to connect hard drives and other USB devices | eARC | Ethernet', 'Sound: 48 Watts Output | Dolby Digital Plus', 'Smart TV Features: Android 11 | In-Built WiFi | Screen Mirroring | Supported Apps: Netflix, Prime Video, YouTube, etc.| Hand free Voice Control and Google Assistant Operation', 'Display: Full HD', 'Warranty Information: 1 year warranty on Product and 6 months on Accessories']","{""Brand"": ""Blaupunkt"", ""Manufacturer"": ""SPPL"", ""Model"": ""40CSG7112"", ""Model Name"": ""40CSG7112"", ""Model Year"": ""2024"", ""Product Dimensions"": ""11 x 92.5 x 54.5 cm; 5.2 kg"", ""Batteries"": ""1 AAA batteries required. (included)"", ""Item model number"": ""40CSG7112"", ""Memory Storage Capacity"": ""8 GB"", ""Ram Memory Installed Size"": ""1 GB"", ""Operating System"": ""Android"", ""Hardware Interface"": ""USB, HDMI"", ""Tuner Technology"": ""DVB-T"", ""Response Time"": ""10 Milliseconds"", ""Resolution"": ""1920x1080 Pixels"", ""Special Features"": ""Dolby DIgital Plus & DTS TruSurround|10000+ Apps & Games|Google Assistant |ChromeCast built-in"", ""Mounting Hardware"": ""1 Television, 1N LED TV, 1N REMOTE, 1N MANUAL"", ""Number of items"": ""1"", ""Remote Control Description"": ""One Click Netflix, Youtube, Prime Video, Google Play | Google Assistant | With Voice Assitant"", ""Remote control technology"": ""IR, Bluetooth"", ""Display Technology"": ""LED"", ""Standing screen display size"": ""40 Inches"", ""Display Type"": ""IPS"", ""Viewing Angle"": ""178 Degrees"", ""Image Aspect Ratio"": ""16:09"", ""Image brightness"": ""Ultra Brightness"", ""Image contrast ratio"": ""4000:1"", ""Supported image types"": ""GIF, JPEG"", ""Screen Resolution"": ""1920 x 1080 pixel"", ""Audio Encoding"": ""DD"", ""Audio input compatible with the item"": ""Auxiliary"", ""Audio output mode"": ""Surround"", ""Supported audio formats"": ""mp3_audio, wma"", ""Speaker Surround Sound Channel Configuration"": ""Dolby Digital Plus"", ""Speakers Maximum Output Power"": ""48 Watts"", ""Audio Wattage"": ""48 Watts"", ""Voltage"": ""100 Volts"", ""Power Source"": ""AC"", ""Batteries Included"": ""Yes"", ""Batteries Required"": ""Yes"", ""Battery cell composition"": ""Lithium"", ""Refresh Rate"": ""60 Hz"", ""Total USB ports"": ""2"", ""Connector Type"": ""Wi-Fi, USB, Ethernet, HDMI"", ""Maximum Operating Distance"": ""9 Feet"", ""Mounting Type"": ""Wall Mount & Table Mount"", ""Actual viewing angle"": ""178 Degrees"", ""Media Format"": ""AVI, MPEG"", ""Includes Rechargeable Battery"": ""No"", ""Includes remote"": ""Yes"", ""Supports Bluetooth Technology"": ""Yes"", ""Country of Origin"": ""India"", ""Item Weight"": ""5 kg 200 g"", ""ASIN"": ""B0CQ7XYNPG"", ""Best Sellers Rank"": ""#10,315 in Electronics (See Top 100 in Electronics)   #79 in Smart Televisions"", ""Date First Available"": ""14 December 2023"", ""Packer"": ""B-29,30,31, Phase-II, Noida, Gautam Buddha Nagar, Uttar Pradesh, 201301 ,Contact: 18002744342, consumercare@blaupuktv.in"", ""Importer"": ""B-29,30,31, Phase-II, Noida, Gautam Buddha Nagar, Uttar Pradesh, 201301 ,Contact: 971108885, consumercare@blaupuktv.in"", ""Item Dimensions LxWxH"": ""11 x 92.5 x 54.5 Centimeters"", ""Net Quantity"": ""1 Count"", ""Generic Name"": ""Television""}"
B0D3XCSDV6,Hisense 139 cm (55 inches) E68N Series 4K Ultra HD Smart Google QLED TV (Grey) | Quantum Dot Color | Dolby Vision | HDR 10+ | AI Sports Mode,"39,999",1235,4.2,https://m.media-amazon.com/images/I/71OHaAE5NAL._SL1500_.jpg,"[""https://m.media-amazon.com/images/I/71OHaAE5NAL._SL1500_.jpg"", ""https://m.media-amazon.com/images/I/81lKNdZaGQL._SL1500_.jpg"", ""https://m.media-amazon.com/images/I/710BtLqQYpL._SL1500_.jpg"", ""https://m.media-amazon.com/images/I/61+7-CO++VL._SL1500_.jpg"", ""https://m.media-amazon.com/images/I/81gxns68nmL._SL1500_.jpg"", ""https://m.media-amazon.com/images/I/61o9odwdNjL._SL1500_.jpg"", ""https://m.media-amazon.com/images/I/61-AeyipqsL._SL1500_.jpg"", ""https://m.media-amazon.com/images/I/81dNq-RBSYL._SL1500_.jpg"", ""https://m.media-amazon.com/images/I/81eVSab7rqL._SL1500_.jpg"", ""https://m.media-amazon.com/images/I/71c+VC1BJtL._SL1500_.jpg"", ""https://m.media-amazon.com/images/I/81VQ5q83qtL._SL1500_.jpg"", ""https://m.media-amazon.com/images/I/81tzIvwkWeL._SL1500_.jpg"", ""https://m.media-amazon.com/images/I/81je1WoNJ5L._SL1500_.jpg"", ""https://m.media-amazon.com/images/I/81kj7NbmqrL._SL1500_.jpg""]",,"['Resolution: 4K Ultra HD (3840 x 2160) | QLED | Refresh Rate: 60 hertz', 'Connectivity: 3 HDMI ports to connect set top box (HDMI 3 eARC supported) | 2 USB 2.0 ports to connect hard drives and other USB devices | Built-in Dual Bands Wi-Fi | Bluetooth 5.3 | 1 RJ45 connector | 1 earphone Jack | 1 Optical digital audio output (SPDIF) | 1 RF- Radio frequency inputs | 1 AV input', 'Sound: 24W Speakers Output | Dolby Atoms | Dobly Digital | Audio equalizer | Lip-sync adjustment | Multiple Sound Modes: Standard, Theatre, Sports, Music, Speech, Late Night', 'Smart TV Features: Google TV | Google Assistant | Far Field Voice Control | Screen Mirroring: DLNA, Chromecast, Miracast, AirPlay | Sleep Timer | On/Off Timer | Supported Apps: Netflix, YouTube, Prime Video, Hotstar, SonyLiv, Hungama, JioCinema, Zee5, Eros Now', 'Display: Quantum Dot Technology | 8bit+FRC color depth | 178 drgrees wide viewing angle | Wide Color Gamut | 4000 : 1 Native contrast ratio | 120 High Refresh Rate | VRR | ALLM | MEMC | HDR 10+ | HLG | Dolby Vision | Multiple picture modes supported: Dynamic, Standard, Sports, PC/Game, Energy Saving, Cinema, FILMMAKER MODE', 'Warranty: 2 year comprehensive warranty on product provided by the brand from the date of purchase']","{""Brand"": ""Hisense"", ""Manufacturer"": ""\u200eDIXON TECHNOLOGY (INDIA) LIMITED"", ""Model"": ""55E68N"", ""Model Name"": ""55E68N"", ""Model Year"": ""2024"", ""Product Dimensions"": ""8 x 111.9 x 64.9 cm; 9.4 kg"", ""Item model number"": ""55E68N"", ""Memory Storage Capacity"": ""16 GB"", ""Ram Memory Installed Size"": ""2 GB"", ""Operating System"": ""Google TV"", ""Hardware Interface"": ""S/PDIF, Bluetooth, USB, Ethernet, HDMI"", ""Tuner Technology"": ""DVB-T / DVB-T2"", ""Response Time"": ""8 Milliseconds"", ""Resolution"": ""3840x2160 Pixels"", ""Compatible Devices"": ""Laptop, Gaming Console, Headphone, Smartphone, Speaker"", ""Special Features"": ""QLED | HDR 10+ | Dolby Vision | 120 High Refresh Rate | 4K AI Upscaler | Direct Full Array | Pixel Tuning | Depth Enhancer | Game Mode Plus | AI Sports Mode | Filmmaker Mode | Far Field Voice Control | VRR and ALLM | MEMC | HLG | Dolby Digital | Google Assistant | Screen mirroring | Multiple picture modes supported | Supported Apps : Netflix, Youtube, Prime Video, Disney+Hotstar, SonyLiv, Hungama, JioCinema, Zee5, Eros Now"", ""Mounting Hardware"": ""\u200e\u200e1 TV Unit, 1 Remote, 2 Table Stand, 1 User Manual, 2 Batteries, 1 Warranty Card"", ""Number of items"": ""1"", ""Remote Control Description"": ""One touch access to you\u2019re your favourite OTT Apps"", ""Remote control technology"": ""Bluetooth"", ""Display Technology"": ""QLED"", ""Standing screen display size"": ""55 Inches"", ""Display Type"": ""QLED | HDR 10+ | HLG | Dolby Vision | 4000 : 1 Native contrast ratio | 8bit+FRC color depth"", ""Colour Screen"": ""Yes"", ""Viewing Angle"": ""178 Degrees"", ""Image Aspect Ratio"": ""16:09"", ""Image brightness"": ""High Brightness"", ""Image contrast ratio"": ""4000:1"", ""Supported image types"": ""GIF, PNG, JPEG"", ""Aspect Ratio"": ""16:9"", ""Audio input compatible with the item"": ""HDMI"", ""Audio output mode"": ""Surround"", ""Supported audio formats"": ""mp3_audio, wma"", ""Speaker Surround Sound Channel Configuration"": ""Dolby Atmos, 2.0 Channel"", ""Speakers Maximum Output Power"": ""24 Watts"", ""Audio Wattage"": ""24 Watts"", ""Voltage"": ""240 Volts"", ""Wattage"": ""110 Watts"", ""Power Source"": ""AC"", ""Batteries Included"": ""Yes"", ""Batteries Required"": ""Yes"", ""Battery cell composition"": ""Alkaline"", ""Refresh Rate"": ""60 Hz"", ""Total USB ports"": ""2"", ""Connector Type"": ""Bluetooth, Wi-Fi, USB, Ethernet, HDMI"", ""Maximum Operating Distance"": ""30 Feet"", ""Mounting Type"": ""Wall Mount & Table Mount"", ""Actual viewing angle"": ""178 Degrees"", ""Media Format"": ""AVI, MPEG"", ""Includes Rechargeable Battery"": ""No"", ""Includes remote"": ""Yes"", ""Supports Bluetooth Technology"": ""Yes"", ""Country of Origin"": ""India"", ""Item Weight"": ""9 kg 400 g"", ""ASIN"": ""B0D3XCSDV6"", ""Best Sellers Rank"": ""#11,169 in Electronics (See Top 100 in Electronics)   #88 in Smart Televisions"", ""Date First Available"": ""16 July 2024"", ""Packer"": ""\u200eDIXON TECHNOLOGY (INDIA) LIMITED"", ""Item Dimensions LxWxH"": ""8 x 111.9 x 64.9 Centimeters"", ""Net Quantity"": ""1 Set"", ""Generic Name"": ""Television""}"
B09F6S8BT6,Samsung 80 cm (32 Inches) Wondertainment Series HD Ready LED Smart TV UA32T4340BKXXL (Glossy Black),"15,240",10679,4.1,https://m.media-amazon.com/images/I/71RxCmvnrbL._SL1500_.jpg,"[""https://m.media-amazon.com/images/I/71RxCmvnrbL._SL1500_.jpg"", ""https://m.media-amazon.com/images/I/71kLlbUWbhL._SL1500_.jpg"", ""https://m.media-amazon.com/images/I/71ftBSLomVL._SL1500_.jpg"", ""https://m.media-amazon.com/images/I/61ssPHyQelL._SL1500_.jpg"", ""https://m.media-amazon.com/images/I/616vdmuZhvL._SL1306_.jpg"", ""https://m.media-amazon.com/images/I/81ovFReIMHL._SL1500_.jpg"", ""https://m.media-amazon.com/images/I/81TJFgPOQfL._SL1500_.jpg"", ""https://m.media-amazon.com/images/I/81wG513TyFL._SL1500_.jpg"", ""https://m.media-amazon.com/images/I/71deF294-zL._SL1500_.jpg"", ""https://m.media-amazon.com/images/I/81rMcTlWSpL._SL1500_.jpg"", ""https://m.media-amazon.com/images/I/81oEA6JFloL._SL1500_.jpg"", ""https://m.media-amazon.com/images/I/71zrcQNd3IL._SL1500_.jpg"", ""https://m.media-amazon.com/images/I/71GGGm+0YWL._SL1500_.jpg""]",,"['Resolution: HD Ready (1366x768) | Refresh Rate: 60 hertz', 'Connectivity: 2 HDMI ports to connect set top box, Blu Ray players, gaming console | 1 USB ports to connect hard drives and other USB devices', 'Sound : 20 Watts Output | Dolby Digital Plus', 'Smart TV Features : Personal Computer | Screen Share | Music System | Content Guide | Connect Share Movie', 'Display : LED Panel | Mega Contrast | PurColor | HD Picture Quality | Slim & Stylish Design', 'Warranty Information: 1 year comprehensive warranty plus additional 1 years on panel by brand from date of invoice']","{""Brand"": ""Samsung"", ""Manufacturer"": ""Samsung India Electronics Limited"", ""Model"": ""UA32T4340BKXXL"", ""Model Name"": ""UA32T4340BKXXL"", ""Model Year"": ""2021"", ""Product Dimensions"": ""8.3 x 73.2 x 43.9 cm; 3.8 kg"", ""Item model number"": ""UA32T4340BKXXL"", ""Ram Memory Installed Size"": ""1.5 GB"", ""Operating System"": ""Tizen"", ""Hardware Interface"": ""USB, HDMI"", ""Graphics Coprocessor"": ""Hyper Real"", ""Tuner Technology"": ""DVB-T2"", ""Resolution"": ""1366 x 768 Pixels"", ""Special Features"": ""HD Picture Quality | HotKeys for quick access of OTT App | Samsung TV Plus | Smart Browser"", ""Mounting Hardware"": ""\u200e1 LED TV, 1 User Manual, 1 Warranty Card, 1 Remote Control, 2 AAA Batteries, Wall Mount / Table Top will be provided at the time of installation based on customer preferences."", ""Number of items"": ""1"", ""Remote Control Description"": ""Hotkey for Prime Video, Netflix and Zee5"", ""Display Technology"": ""LED"", ""Standing screen display size"": ""32 Inches"", ""Display Type"": ""HDR"", ""Viewing Angle"": ""178 Degrees"", ""Image Aspect Ratio"": ""16:09"", ""Supported image types"": ""JPEG"", ""Aspect Ratio"": ""16:9"", ""Screen Resolution"": ""1366 x 768 pixels"", ""Audio input compatible with the item"": ""Auxiliary"", ""Audio output mode"": ""Stereo"", ""Supported audio formats"": ""mp3_audio, wma"", ""Speaker Surround Sound Channel Configuration"": ""Dolby Digital Plus"", ""Audio Wattage"": ""20 Watts"", ""Voltage"": ""240 Volts"", ""Wattage"": ""20 Watts"", ""Power Source"": ""AC"", ""Batteries Required"": ""No"", ""Refresh Rate"": ""60 Hz"", ""Total USB ports"": ""1"", ""Connector Type"": ""Wi-Fi, USB, Ethernet, HDMI"", ""Mounting Type"": ""Wall Mount & Table Mount"", ""Includes remote"": ""Yes"", ""Supports Bluetooth Technology"": ""No"", ""Country of Origin"": ""India"", ""Item Weight"": ""3 kg 800 g"", ""ASIN"": ""B09F6S8BT6"", ""Best Sellers Rank"": ""#2,012 in Electronics (See Top 100 in Electronics)   #23 in Smart Televisions"", ""Date First Available"": ""1 September 2021"", ""Packer"": ""Samsung India Electronics Pvt. Ltd. having its Registered Office at: 6th Floor, DLF Centre, Sansad Marg, New Delhi-110001"", ""Importer"": ""Samsung India Electronics Pvt. Ltd. having its Registered Office at: 6th Floor, DLF Centre, Sansad Marg, New Delhi-110001"", ""Item Dimensions LxWxH"": ""8.3 x 73.2 x 43.9 Centimeters"", ""Net Quantity"": ""1 count"", ""Generic Name"": ""Television""}"
